{"_type":"https://in-toto.io/Statement/v1","predicate":{"cacheKey":"1497297bfd1bad4292948823223dc6743e91474ea0ef3b6acb2f770f2a411794","executor":{"attestation":{"agentId":"agent-0001","capDigest":"2c7e4ac7e130520bd63457aeba72e6d5ad688952cc495c33bc9f810b27b80faa","transcriptDigest":"d44cf2f470ca35bffa678d67da9e949a742c9783078a479c94d8b15f1a5a0318"},"blind":true,"channel":"host-subagent","harness":{"name":"claude-code","version":"2.1.292"},"isolation":"restricted-attested","model":{"name":"claude-sonnet-5-5","source":"resolved"},"promptDigest":"42e894def1fb4400f42b9fdd6bc5a0ce76ab7aabd0ad9c3c527cd7f97760782a"},"extensions":{"decision":{"basis":"judges","confidenceSource":"host-votes(2)","deciders":["claude-sonnet-5-5"],"rawConfidence":0.9,"threshold":0.7}},"inputs":[{"digest":{"sha256":"0999717259a54874ed40b2922e63f1c327fe4e8c23009b25aa4368abe9cbd982"},"name":"decision-policy","role":"decision_policy"},{"digest":{"sha256":"0a885768be2c7bf5d32ece225babbab463270abac7c0b5cae474c1fb331ce479"},"name":"claude-sonnet-5-5","role":"model_id"},{"digest":{"sha256":"8cd363c84dfde9448ff169b2f915a45fb114ab87d4bd1e35a195d50e55c8cf4d"},"name":"alignment-judge","role":"prompt_template"},{"annotations":{"criterion":"PARK-2~1"},"digest":{"sha256":"358d4c7332a82933f0ba5360aa7a9e592ebcdec4b836030944991528cdab812d"},"name":"discriminating-power","role":"proof"},{"digest":{"sha256":"bd1396ac2da46b9503fee0cb114aea9fa418579d2cf3e1b2f3d7c4ee1837c99c"},"name":"PARK-2~1","role":"spec"},{"digest":{"sha256":"13d920e17f8d367c0eae40a03fe683cb7aa5b8e9485697e964f4ec8f12460977"},"name":"tests/test_parkfee.py","role":"test_source"}],"module":{"name":"spec-proof-alignment","version":"0.1.0"},"producedBy":"ci","requirement":{"id":"PARK-2","revision":1,"statementCanonicalization":"c1"},"test":"test_grace_period_is_free","verdict":{"class":"judged","confidence":1.5,"value":"ALIGNED"}},"predicateType":"https://rachid-chabane.com/attestations/alignment/v1","subject":[{"digest":{"sha256":"bd1396ac2da46b9503fee0cb114aea9fa418579d2cf3e1b2f3d7c4ee1837c99c"},"name":"PARK-2~1"}]}
