{"_type":"https://in-toto.io/Statement/v1","predicate":{"cacheKey":"5023b3341bb79ff8b797c79aee976493b15a15ef21f97210bc1aae0c05fb37fd","correctCodePasses":{"class":"executed","corroboratedBy":[{"digest":"557f87c06d27354509720207c6aa7d53950ea7d4592321055625176773dd23a1","kind":"specific_kill"}],"value":true},"examples":[{"index":0,"result":{"class":"executed","value":"passed"}},{"index":1,"result":{"class":"executed","value":"passed"}}],"executor":{"attestation":{"agentId":"agent-0001","capDigest":"2c7e4ac7e130520bd63457aeba72e6d5ad688952cc495c33bc9f810b27b80faa","transcriptDigest":"d44cf2f470ca35bffa678d67da9e949a742c9783078a479c94d8b15f1a5a0318"},"blind":true,"channel":"host-subagent","harness":{"name":"claude-code","version":"2.1.292"},"isolation":"restricted-attested","model":{"name":"claude-opus-5-5","source":"resolved"},"promptDigest":"2e6d2bc679a3f0f9b7da4f2afb3117709ef9036ed579a901df4e4a3f799c9324"},"extensions":{"operatorScreen":{"flagged":2,"screenedOut":37}},"inputs":[{"digest":{"sha256":"c8897c1b5c396fae8812099e85bc98b6fda1c41ef1c386da726eb3a5605e448e"},"name":"src/parkfee.py","role":"code_tree"},{"digest":{"sha256":"0999717259a54874ed40b2922e63f1c327fe4e8c23009b25aa4368abe9cbd982"},"name":"decision-policy","role":"decision_policy"},{"digest":{"sha256":"26064c48c71b6b8e8efc4bf7d20a28d85fbaea635b342ed6147dc101028944d3"},"name":"example-binding","role":"example_binding"},{"digest":{"sha256":"f034472fc202ce69d90cc9670247e7e1151d2a582b785e29e2e14eeea7b1b394"},"name":"host-responses","role":"host_response"},{"digest":{"sha256":"73e2c34a38ee9c61fc65710dbe70b9a39d58704c4769b6c9bcbbb782c4b6c35b"},"name":"junit-outcomes","role":"junit_result"},{"digest":{"sha256":"495642e1ba6d98d9e1f90e11d253817115e85b89dd6a8c4f2506d284c0faaf95"},"name":"claude-opus-5-5","role":"model_id"},{"digest":{"sha256":"0b7077453303ac9ab3003911fa30a2c2586a1d6fb4a3f805c6c36eec8cce9835"},"name":"mutant-set","role":"mutant_set"},{"digest":{"sha256":"0e6f15d3dd2865ea72060c8801d3afec1ab5c7bab7bc765fedf696f23b58c8d6"},"name":"mutant-generator","role":"prompt_template"},{"digest":{"sha256":"cd9b9eca1593cdf49bdd6eed1ddc8c7cdf47ef5bc3d16d07bc0ec0c551005b98"},"name":"specs/parkfee.md","role":"spec"},{"digest":{"sha256":"52ab42621aa58b4661cb9bd0c9b5d35bfd655f5f5629e8cc901070c811fffd16"},"name":"tests/test_parkfee.py","role":"test_source"}],"module":{"name":"spec-proof-discriminating-power","version":"0.1.0"},"mutants":[{"digest":"1f8f353f22a69c043a7fbe3a6dd5e7095802216f96d39d90a71d0fbdaf377de8","extensions":{"decision":{"basis":"construction","deciders":["sentinel-catalogue"],"rawConfidence":1,"threshold":0.7}},"results":[{"outcome":{"class":"executed","value":"survived"},"test":"test_grace_period_boundary"},{"outcome":{"class":"executed","value":"survived"},"test":"test_grace_period_is_free"}],"sentinel":true,"validity":{"class":"judged","confidence":1,"value":"EQUIVALENT"}},{"digest":"8aa3a042d3499c1384a987315d324af25b482816855e5fbe66a8897bf228e966","results":[{"outcome":{"class":"executed","value":"survived"},"test":"test_grace_period_boundary"},{"outcome":{"class":"executed","value":"survived"},"test":"test_grace_period_is_free"}],"validity":{"class":"judged","confidence":0.95,"value":"EQUIVALENT"}},{"digest":"dfa180fe7438bb52211f4654002d78152fd905a47f228739b74ac37cb057dd3d","extensions":{"decision":{"basis":"spec_example","deciders":["example-0"],"rawConfidence":1,"threshold":0.7}},"results":[{"outcome":{"class":"executed","value":"killed"},"test":"test_grace_period_boundary"},{"outcome":{"class":"executed","value":"survived"},"test":"test_grace_period_is_free"}],"validity":{"class":"judged","confidence":1,"corroboratedBy":[{"digest":"d25315c9d47428a48cefb956fd61958eabf8909c8cbedd362b75e8b5e073ce53","kind":"example_failed"}],"value":"VALID"}}],"producedBy":"ci","requirement":{"id":"PARK-2","revision":1,"statementCanonicalization":"c1"},"tests":["test_grace_period_boundary","test_grace_period_is_free"]},"predicateType":"https://rachid-chabane.com/attestations/discriminating-power/v1","subject":[{"digest":{"sha256":"bd1396ac2da46b9503fee0cb114aea9fa418579d2cf3e1b2f3d7c4ee1837c99c"},"name":"PARK-2~1"}]}
