{"_type":"https://in-toto.io/Statement/v1","predicate":{"cacheKey":"3cf6a7f904343bb6f4ff998247bbc5d6f69fb5f36529dedd04cc8c1b4d409688","executor":{"attestation":{"agentId":"agent-0001","capDigest":"2c7e4ac7e130520bd63457aeba72e6d5ad688952cc495c33bc9f810b27b80faa","transcriptDigest":"d44cf2f470ca35bffa678d67da9e949a742c9783078a479c94d8b15f1a5a0318"},"blind":true,"channel":"host-subagent","harness":{"name":"claude-code","version":"2.1.292"},"isolation":"restricted-attested","model":{"name":"claude-sonnet-5-5","source":"resolved"},"promptDigest":"42e894def1fb4400f42b9fdd6bc5a0ce76ab7aabd0ad9c3c527cd7f97760782a"},"extensions":{"decision":{"basis":"judges","deciders":["claude-sonnet-5-5"],"rawConfidence":0.9,"threshold":0.7}},"inputs":[{"digest":{"sha256":"0999717259a54874ed40b2922e63f1c327fe4e8c23009b25aa4368abe9cbd982"},"name":"decision-policy","role":"decision_policy"},{"digest":{"sha256":"0a885768be2c7bf5d32ece225babbab463270abac7c0b5cae474c1fb331ce479"},"name":"claude-sonnet-5-5","role":"model_id"},{"digest":{"sha256":"8cd363c84dfde9448ff169b2f915a45fb114ab87d4bd1e35a195d50e55c8cf4d"},"name":"alignment-judge","role":"prompt_template"},{"digest":{"sha256":"46f003798817161e1cb7e47f4811efa3d30c76ccaf7a59d8d1620aa3c0c28f04"},"name":"discriminating-power","role":"proof"},{"digest":{"sha256":"cd9b9eca1593cdf49bdd6eed1ddc8c7cdf47ef5bc3d16d07bc0ec0c551005b98"},"name":"specs/parkfee.md","role":"spec"},{"digest":{"sha256":"52ab42621aa58b4661cb9bd0c9b5d35bfd655f5f5629e8cc901070c811fffd16"},"name":"tests/test_parkfee.py","role":"test_source"}],"module":{"name":"spec-proof-alignment","version":"0.1.0"},"producedBy":"ci","requirement":{"id":"PARK-2","revision":1,"statementCanonicalization":"c1"},"test":"test_grace_period_is_free","verdict":{"class":"judged","confidence":0.9,"value":"ALIGNED"}},"predicateType":"https://rachid-chabane.com/attestations/alignment/v1","subject":[{"digest":{"sha256":"bd1396ac2da46b9503fee0cb114aea9fa418579d2cf3e1b2f3d7c4ee1837c99c"},"name":"PARK-2~1"}]}
