{"_type":"https://in-toto.io/Statement/v1","predicate":{"advisory":false,"cacheKey":"e17970e6b3125960f4facb5015a2e98bc33bcbc24b19048d0c570759b7add0a4","extensions":{},"inputs":[{"digest":{"sha256":"0999717259a54874ed40b2922e63f1c327fe4e8c23009b25aa4368abe9cbd982"},"name":"decision-policy","role":"decision_policy"},{"digest":{"sha256":"cd9b9eca1593cdf49bdd6eed1ddc8c7cdf47ef5bc3d16d07bc0ec0c551005b98"},"name":"specs/parkfee.md","role":"spec"}],"module":{"name":"spec-proof-completeness","version":"0.1.0"},"outOfScopeDeclared":[{"dimension":"concurrency","reason":"single-threaded batch tool"}],"producedBy":"ci","questions":[{"dimension":"boundaries","question":"What is charged at exactly 15 minutes?","requirementIds":["PARK-2"]},{"dimension":"time_and_locale","question":"Which time zone defines the night window?"}]},"predicateType":"https://rachid-chabane.com/attestations/completeness/v1","subject":[{"digest":{"sha256":"4a0ecc6045ff60a3202d7949b3ff8801e56ec659155df9cc688f4ed60b9dfdfc"},"name":"specs/parkfee.md"}]}
